{
  "repository": "block/ai-rules",
  "upstream": {
    "default_branch": "main",
    "pinned_ref": "b2c1cd16d05f47053eb3f059f87524f7b6ee1a1f",
    "archived": false,
    "moved_from": null
  },
  "license": {
    "status": "verified",
    "identifier": "Apache-2.0",
    "notice_required": true,
    "dependency_review": "conditional"
  },
  "runtime": {
    "build_reproduced": true,
    "self_hostable": "yes",
    "private_dependencies": [],
    "required_services": [
      "Rust toolchain",
      "local project filesystem",
      "symlink support or generated-file fallback"
    ]
  },
  "scores": {
    "product_fit": 5,
    "license_confidence": 5,
    "self_hostability": 5,
    "independence": 5,
    "maintenance": 4,
    "security": 4,
    "integration_cost": 2,
    "replacement_difficulty": 2
  },
  "target": "Amarax agent instruction compiler and repository skill distribution tooling",
  "disposition": "ADOPT",
  "conditions": [
    "Adopt as developer tooling and a compilation or synchronization layer, not as the authoritative Sophie-X or Orynero runtime policy engine.",
    "Pin a release or commit and execute it through a wrapper owned by the target repository.",
    "Review clean, generate, symlink, nested-directory, and overwrite behavior against repository boundaries before automation is enabled.",
    "Do not place secrets directly in source MCP configuration files; generated outputs must reference approved environment or secret providers.",
    "Validate generated files in CI and require a clean diff after regeneration.",
    "Review each multi-license expression, license file, build script, installer, binary release, asset and notice obligation before redistribution.",
    "Preserve Apache-2.0 and applicable copyright or NOTICE material."
  ],
  "evidence": [
    "README.md describes a CLI that generates and synchronizes rule files for AMP, Claude, Cline, Codex, Copilot, Cursor, Firebender, Gemini, Goose, Kilocode, and Roo from one source.",
    "README.md documents init, generate, status, clean, agent selection, nested generation, and MCP configuration support.",
    "Cargo.toml declares version 1.7.0, a Rust 2021 binary, Apache License 2.0, and a small set of common parsing, CLI, filesystem, and serialization dependencies.",
    "docs/project-structure.md defines repository, nested package, command, skill, MCP, Codex overlay, symlink, and generated-file layouts.",
    "docs/mcp.md shows that the tool transforms one MCP source into agent-specific configuration files; this is distribution behavior rather than runtime authorization or policy enforcement.",
    "Platform Replication Upstream Build Verification run 30147827108 checked out the pinned commit and completed license verification, cargo fmt, Clippy, the full Rust test suite, and a release build successfully.",
    "Upstream SBOM Evidence run 30148183032 generated locked Cargo metadata and recorded 110 components with zero unresolved normalized license fields. Multi-license expressions and non-package content remain subject to explicit import review."
  ],
  "reviewed_at": "2026-07-25",
  "reviewer": "Sophie-X / Amarax Platform Replication"
}